{
    "setup": {
      "viewer-version": "1.0.0",
      "points": [
        {
          "startValue": 1000,
          "fullName": "Character Points",
          "name": "Pts",
          "icon": "/icons/character-points.png"
        },
        {
          "startValue": 4,
          "fullName": "Skill Points",
          "name": "SkP",
          "icon": "/icons/skill-points.png"
        }
      ],
      "hideGitLink": true,
      "altLink": "https://github.com/CYOA-Tools/tool--cyoa-web-viewer",
      "altLinkText": "ExLink",
      "effectOrdering": [
        "Archetype",
        "Origin",
        "Allies",
        "Languages",
        "Items"
      ]
    },
    "title": {
      "cyoaName": "Deep Forest CYOA",
      "tagline": "an Adventure",
      "author": "me",
      "version": "0.1"
    },
    "intro": {
      "title": "Welcome to the example",
      "introText": "Sed ut perspiciatis unde omnis iste natus error sit voluptatem accusantium doloremque laudantium, totam rem aperiam, eaque ipsa quae ab illo inventore veritatis et quasi architecto beatae vitae dicta sunt explicabo. Nemo enim ipsam voluptatem quia voluptas sit aspernatur aut odit aut fugit, sed quia consequuntur magni dolores eos qui ratione voluptatem sequi nesciunt. Neque porro quisquam est, qui dolorem ipsum quia dolor sit amet, consectetur, adipisci velit, sed quia non numquam eius modi tempora incidunt ut labore et dolore magnam aliquam quaerat voluptatem. Ut enim ad minima veniam, quis nostrum exercitationem ullam corporis suscipit laboriosam, nisi ut aliquid ex ea commodi consequatur? Quis autem vel eum iure reprehenderit qui in ea voluptate velit esse quam nihil molestiae consequatur, vel illum qui dolorem eum fugiat quo voluptas nulla pariatur?",
      "subtitle": "You start with 1000 MP, choose wisely",
      "baseImage": "/images/base-image.webp"
    },
    "choices": [
      {
        "title": "Character Archetype",
        "description": "The archetype from which your character descends",
        "style": "list",
        "choicesUnique": true,
        "maxChoices": 1,
        "applyToPlayerImage": true,
        "options": [
          {
            "title": "Human Hunter",
            "description": "Your rugged boots have traversed countless miles of wildwood, leaving nary a footprint but those of your prey. With quiver full of arrows at your back and trusty spear in hand, you stalk the shadows with stealth as quiet as night. Your knowledge of stealth and tracking was often employed by men of the law to aid in the search for outlaws.",
            "image": "/images/archetype-human-hunter.webp",
            "cost": [
              0,
              0
            ],
            "effects": [
              {
                "type": "uniqueString",
                "key": "Archetype",
                "data": "Human Hunter"
              },
              {
                "type": "list",
                "key": "Items",
                "data": {
                  "quantity": 1,
                  "name": "Short Bow"
                }
              }
            ]
          }
        ]
      },
      {
        "title": "Origin",
        "description": "The tale of your birth & childhood.",
        "style": "boxes",
        "choicesUnique": true,
        "maxChoices": 1,
        "options": [
          {
            "title": "Origoth - the Cave City",
            "description": "In the depths of the earth, the dwarven city of Origoth thrums with ancient power, its tunnels winding like veins through granite rock. Here, the stout-hearted folk forge their destiny amidst glittering crystals and precious metals. Yet beneath the surface, rival clans jostle for dominance in a struggle that echoes the very earth itself.",
            "image": "/images/origin-origoth.webp",
            "cost": [
              50,
              0
            ],
            "effects": [
              {
                "type": "uniqueString",
                "key": "Origin",
                "data": "Origoth - the Cave City"
              },
              {
                "type": "list",
                "key": "Items",
                "data": {
                  "quantity": 1,
                  "name": "Origoth Lantern"
                }
              }
            ]
          }
        ]
      },
      {
        "title": "Allies",
        "description": "Brothers sworn to your side, and who can be called upon in times of trouble",
        "style": "list",
        "choicesUnique": true,
        "maxChoices": 3,
        "options": [
          {
            "title": "Ragnar 'Thunderhammer' Erifson",
            "description": "A gruff, battle-scarred dwarf with a heart of gold beneath his prickly exterior! When he lets loose with his trusty warhammer, the very earth shakes and giants tremble - but only after he's had his morning ale and a good belly laugh! A loyal ally to count on in the heat of battle. Just don't get him started on his least favorite topic: bards. The mere mention sends him stomping off in a huff, muttering something about 'too many notes'.",
            "image": "/images/ally-ragnar.webp",
            "cost": [
              100,
              0
            ],
            "effects": [
              {
                "type": "list",
                "key": "Allies",
                "data": {
                  "quantity": 1,
                  "name": "Ragnar 'Mad Axe' Erifson"
                }
              }
            ]
          },
          {
            "title": "Karrick 'Steel' Olborn",
            "description": "A foul-mouthed human with a penchant for causing chaos! His battle tactics are as unpredictable as his next hangover, leaving enemies reeling from one wild swing to the next. Though his strategies may not always succeed... they never fail to entertain! Just don't expect him to lend you any of his famous 'Riot's Revenge' ale after a long day of pillaging - unless you're buying! As for romance, he has a soft spot for curvaceous beauty and isn't afraid to show it.",
            "image": "/images/ally-karrick.webp",
            "cost": [
              50,
              0
            ],
            "effects": [
              {
                "type": "list",
                "key": "Allies",
                "data": {
                  "quantity": 1,
                  "name": "Karrick 'Steel' Olborn"
                }
              }
            ]
          }
        ]
      },
      {
        "title": "Items",
        "description": "The right equipment can keep you alive when the tide turns against you.",
        "style": "boxes",
        "choicesUnique": false,
        "maxChoices": 10,
        "options": [
          {
            "title": "Elixir of heaven's dew",
            "description": "A misty but radiant, honey colored brew infused with the essence of dawn flowers and blessed by the morning sun goddess. Drink deep and let healing energies course through your veins - the perfect remedy for those seeking to cheat mortal fate! Just be warned, it' might just leave you feeling a bit too peppy come nightfall.",
            "image": "/images/item-elixir.webp",
            "cost": [
              100,
              0
            ],
            "effects": [
              {
                "type": "list",
                "key": "Items",
                "data": {
                  "quantity": 1,
                  "name": "Elixir of heaven's dew"
                }
              }
            ]
          },
          {
            "title": "Mechanical Talisman",
            "description": "An ornate amulet that whispers ominous warnings to its wearer, telling it's user of approaching dangers and which direction they are coming. Of little use beyond a mile, and inaccurate beyond a hundred yards",
            "image": "/images/item-talisman.webp",
            "cost": [
              100,
              0
            ],
            "unique": true,
            "effects": [
              {
                "type": "list",
                "key": "Items",
                "data": {
                  "quantity": 1,
                  "name": "Mechanical Talisman"
                }
              }
            ]
          }
        ]
      },
      {
        "title": "Skills",
        "description": "You are no ordinary man, your training has developed within you rare skills.",
        "style": "boxes",
        "choicesUnique": true,
        "maxChoices": 2,
        "options": [
          {
            "title": "Tactician",
            "description": "You have a powerful capacity for tactical thinking",
            "cost": [
              0,
              2
            ],
            "effects": [
              {
                "type": "list",
                "key": "skill",
                "data": {
                  "quantity": 1,
                  "name": "Tactician"
                }
              }
            ]
          }
        ]
      }
    ],
    "style": {
      "import": {
        "text": "https://fonts.googleapis.com/css2?family=Audiowide&family=Sedan+SC&display=swap"
      },
      "text": {
        "familyMain": "'Sedan SC', sans",
        "rootSize": "18px",
        "textColor": "#000fff"
      },
      "paragraph": {
        "lineHeight": "1.7",
        "letterSpacing": "1.2px",
        "fontFamily": "Georgia, serif"
      },
      "main": {
        "backgroundColor": "linear-gradient(61deg, rgba(73,101,1,1) -20%, rgba(92,123,20,1) 57%, rgba(2,60,64,1) 130%);",
        "textColor": "#023C40",
        "cardColor": "#023C40",
        "cardBorderColor": "#2C3D01",
        "cardBorderRadius": "0.25rem",
        "cardBorderWidth": true,
        "boxBg": "#012527",
        "unselectionBorder": "1px solid transparent",
        "unselectionBg": "transparent",
        "unselectionBoxBorder": "1px solid black",
        "unselectionBoxBg": "#035E63",
        "selectionBorder": "1px solid #64CE9E",
        "selectionBg": "#012527",